{
  "log": {
    "path": "/var/log/restic-client",
    "retainLogs": "30:00:00:00"
  },
  "resticBinary": "/usr/local/bin/restic",
  "backupIgnoreFilename": ".backupignore",
  "snapshotSchedule": {
    "enabled": false,
    "unit": "restic-client-snapshot.timer"
  },
  "retentionSchedule": {
    "enabled": true,
    "unit": "restic-client-retention.timer"
  },
  "repositories": [
    {
      "name": "paperless",
      "snapshotAllowed": true,
      "restoreAllowed": true,
      "forgetAllowed": false,
      "resticRepository": "rest:http://paperless:SECRET@backup.lan:8000/paperless/paperless",
      "repositoryPassword": "RESTIC_REPOSITORY_PASSWORD",
      "path": "/media/paperless-data/export",
      "backupPreCommand": "/usr/local/bin/paperless-export-backup",
      "resticBackupOptions": [
        "--skip-if-unchanged"
      ],
      "forgetArgs": []
    }
  ]
}
